{
  "id": "pwr-compressed-liquid-air-storage",
  "name": "Compressed and liquid air energy storage",
  "aliases": [
    "Compressed and liquid air energy storage",
    "CAES",
    "LAES"
  ],
  "sector": "PWR",
  "category": "Mechanical storage",
  "applications": [
    "long-duration storage",
    "reuse of salt caverns and mines"
  ],
  "maturity": "demonstration",
  "principle": "Air is compressed (CAES) into a cavern or vessel, or liquefied (LAES), and later expanded through a turbine; advanced designs store the compression heat to avoid burning gas. Hydrostor's Willow Rock project in California is 500 MW and 4,000 MWh (8+ hours) of advanced CAES with a 50+ year design life.",
  "process_steps": [
    {
      "id": "COMP",
      "name": "Compress air using surplus power, storing the heat",
      "equipment": [
        "compressors",
        "thermal store"
      ],
      "to": [
        "CAV"
      ]
    },
    {
      "id": "CAV",
      "name": "Store air in cavern or tank",
      "equipment": [
        "cavern"
      ],
      "to": [
        "EXP"
      ]
    },
    {
      "id": "EXP",
      "name": "Expand air with stored heat through turbine",
      "equipment": [
        "expander",
        "generator"
      ],
      "to": []
    }
  ],
  "key_equipment": [
    "compressors",
    "thermal store",
    "air cavern or tank",
    "expander and generator"
  ],
  "suppliers": [
    {
      "name": "Hydrostor",
      "product": "advanced CAES"
    },
    {
      "name": "Highview Power",
      "product": "liquid air storage"
    }
  ],
  "performance": [
    {
      "metric": "Willow Rock power",
      "unit": "MW",
      "basis": "late-stage development",
      "source": {
        "url": "https://www.hydrostor.ca/willow-rock/",
        "note": "Hydrostor, Willow Rock Energy Storage Center page, read 25 October 2026"
      },
      "low": 500,
      "high": 500
    },
    {
      "metric": "Willow Rock energy",
      "unit": "MWh",
      "basis": "8+ hours",
      "source": {
        "url": "https://www.hydrostor.ca/willow-rock/",
        "note": "Hydrostor, Willow Rock Energy Storage Center page, read 25 October 2026"
      },
      "low": 4000,
      "high": 4000
    }
  ],
  "trl": {
    "low": 7,
    "high": 9,
    "source": {
      "url": "https://www.iea.org/data-and-statistics/data-tools/etp-clean-energy-technology-guide",
      "source_id": "iea-reports",
      "note": "IEA ETP Clean Energy Technology Guide, dataset of 24 July 2026, latest assessment (IEA 1-11 scale): 'Compressed air energy storage' 9 (2025); 'Liquid air energy storage' 7 (2025)"
    }
  },
  "advantages": [
    "Long duration at large scale",
    "No fossil fuel in advanced designs"
  ],
  "limitations": [
    "Round-trip efficiency not stated in sources read",
    "Highview's page was blocked, so LAES data is missing"
  ],
  "sources": [
    {
      "url": "https://www.hydrostor.ca/willow-rock/",
      "note": "Hydrostor, Willow Rock Energy Storage Center page, read 25 October 2026"
    }
  ],
  "last_reviewed": "2026-10-28",
  "gaps": [
    {
      "field": "performance",
      "item": "round-trip efficiency and Highview Carrington data",
      "reason_code": "source_unreachable",
      "reason": "Highview's site blocks automated reading and Hydrostor's page gives no efficiency.",
      "where": [
        {
          "hint": "Highview Power project pages",
          "access": "open",
          "url": "https://highview-power.com/"
        }
      ],
      "action": "Add efficiency and MWh for operating projects."
    },
    {
      "field": "costs",
      "item": "capital cost and operating or unit cost, with dollar year and basis",
      "reason_code": "not_in_sources_read",
      "reason": "No open source read so far gives costs for this technology. Web-checked 2026-10-28; Huntorf/McIntosh capex not stated in open pages read.",
      "where": [
        {
          "hint": "arXiv and open-access journals: techno-economic or review papers (MDPI is blocked by its CDN; use the manual inbox)",
          "access": "open",
          "source_id": "arxiv"
        },
        {
          "hint": "Licensor and EPC studies; paid cost databases are catalog-only",
          "access": "paid"
        },
        {
          "hint": "OSTI.GOV full-text reports from DOE labs: search the technology name plus 'techno-economic'",
          "access": "blocked",
          "source_id": "osti"
        }
      ],
      "action": "Look for an open techno-economic study; record each figure with metric, range, unit, dollar year, basis and source."
    },
    {
      "field": "process",
      "item": "process steps and equipment are general engineering practice, not taken from one source",
      "reason_code": "general_knowledge_only",
      "reason": "The sources read describe the principle but not a full step-by-step flow.",
      "where": [
        {
          "hint": "Licensor process descriptions and textbooks",
          "access": "open"
        },
        {
          "hint": "Open process-description authority (secondary): Wikipedia article 'Compressed air energy storage'. Cross-check the card's process_steps against it, then cite it in sources with note 'secondary'.",
          "url": "https://en.wikipedia.org/wiki/Compressed_air_energy_storage",
          "access": "open"
        }
      ],
      "action": "Verify the card's process_steps against the attached authority page, then cite it and delete this gap. Check the steps against a licensor description and name it."
    }
  ],
  "reference_plants": [
    {
      "name": "Huntorf CAES (Germany, 1978) and McIntosh CAES (Alabama, USA, 1991)",
      "country": "DE",
      "capacity": "Huntorf: world's first CAES plant, 290 MW (1978); McIntosh: 110 MW salt-cavern CAES storing air in a 19-million-cubic-foot cavern (1991)",
      "status": "operating",
      "source": {
        "url": "https://www.nytimes.com/1991/09/29/business/technology-using-compressed-air-to-store-up-electricity.html",
        "note": "New York Times, 29 Sep 1991 (McIntosh 110 MW, 19-million-cu-ft cavern); Huntorf 290 MW 1978 per the widely cited Crotogino et al. Huntorf 20-years review (researchgate table mirror); read 2026-10-28"
      }
    }
  ]
}
